{
  "$schema": "https://json-schema.org/draft/2020-12/schema",
  "$id": "https://knowledge-hub.local/schemas/verification-verdict.v1.json",
  "title": "knowledge-hub.verification-verdict.v1",
  "description": "Additive verification verdict contract. Verdicts are intentionally limited to pass, fail, or abstain; rewrite-and-retry is not a verdict state or action in this contract.",
  "type": "object",
  "required": ["schema", "verdict"],
  "properties": {
    "schema": { "const": "knowledge-hub.verification-verdict.v1" },
    "verdict": {
      "type": "string",
      "enum": ["pass", "fail", "abstain"]
    },
    "answer_contract_id": { "$ref": "#/$defs/nonEmptyString" },
    "evidence_packet_id": { "$ref": "#/$defs/nonEmptyString" },
    "reason": { "type": "string" },
    "checked_at": { "$ref": "#/$defs/timestamp" },
    "verifier": {
      "type": "object",
      "additionalProperties": true
    },
    "coverage": {
      "type": "object",
      "additionalProperties": true
    },
    "failures": {
      "type": "array",
      "items": {
        "type": "object",
        "additionalProperties": true
      }
    },
    "recommended_action": {
      "type": "string",
      "not": { "const": "rewrite_and_retry" }
    },
    "action": {
      "type": "string",
      "not": { "const": "rewrite_and_retry" }
    },
    "schemaErrors": {
      "type": "array",
      "items": { "type": "string" }
    }
  },
  "$defs": {
    "nonEmptyString": {
      "type": "string",
      "minLength": 1
    },
    "timestamp": {
      "type": "string",
      "pattern": "^\\d{4}-\\d{2}-\\d{2}T\\d{2}:\\d{2}:\\d{2}(?:\\.\\d+)?(?:Z|[+-]\\d{2}:\\d{2})$"
    }
  },
  "not": { "required": ["rewrite_and_retry"] },
  "additionalProperties": true
}
